Series Name,Series Code,Country Name,Country Code,2000 [YR2000],2001 [YR2001],2002 [YR2002],2003 [YR2003],2004 [YR2004],2005 [YR2005],2006 [YR2006],2007 [YR2007],2008 [YR2008],2009 [YR2009],2010 [YR2010],2011 [YR2011],2012 [YR2012],2013 [YR2013],2014 [YR2014],2015 [YR2015],2016 [YR2016],2017 [YR2017],2018 [YR2018],2019 [YR2019],2020 [YR2020],2021 [YR2021],2022 [YR2022],2023 [YR2023]
Renewable energy consumption (% of total final energy consumption),EG.FEC.RNEW.ZS,European Union,EUU,8.98176846645812,8.96648107340237,8.86457575550822,9.27716550106276,9.57806942522037,10.0275617190692,10.685367700046,11.7592819867719,12.489770926183,13.6527413216292,14.4819868668562,14.6476287872772,16.0638884841707,16.8108248593668,17.4502355668158,17.6013864447651,17.5430290745386,17.6948545926672,18.7304117385027,19.3462835156226,21.121106310957,..,..,..
Energy related methane emissions (% of total),EN.ATM.METH.EG.ZS,European Union,EUU,20.0859777665099,20.0411339207211,19.383858556347,19.5908906793762,18.7069069452843,18.681619529961,18.288727686493,17.9487921270068,18.2770175481957,..,..,..,..,..,..,..,..,..,..,..,..,..,..,..
Fossil fuel energy consumption (% of total),EG.USE.COMM.FO.ZS,European Union,EUU,77.3691622042229,77.2359639775046,77.0898352452003,77.063821297462,76.6739390636508,76.409536369311,76.1264281487445,75.7229335752399,74.8315061905348,73.8037383309163,73.1851451802058,72.8294959633627,71.8636525293524,71.0335864186312,69.6752401615765,69.8860261706385,..,..,..,..,..,..,..,..
"Energy use (kg of oil equivalent) per $1,000 GDP (constant 2017 PPP)",EG.USE.COMM.GD.PP.KD,European Union,EUU,99.1172952907322,99.5054628998046,98.4176868976334,99.4726323783134,98.0019450098077,96.2967102683444,93.524238924036,89.2138283608138,88.1972499032889,86.8021506550724,88.427788205831,83.8140381130881,83.3314547100778,82.4604721993732,78.3139600568525,77.5307336573002,..,..,..,..,..,..,..,..
Investment in energy with private participation (current US$),IE.PPI.ENGY.CD,European Union,EUU,..,..,..,..,..,..,..,..,..,..,..,..,..,..,..,..,..,..,..,..,..,..,..,..
Methane emissions in energy sector (thousand metric tons of CO2 equivalent),EN.ATM.METH.EG.KT.CE,European Union,EUU,57960.669267,57916.232858,57712.321484,60033.307883,58413.057576,59761.334218,59919.803381,58919.801361,59803.199838,57643.414612,59732.739189,56232.727254,56678.826513,55285.231238,51207.066834,51849.77783,51397.322413,52123.272324,52061.122233,51534.872147,50002.322057,..,..,..
Nitrous oxide emissions in energy sector (% of total),EN.ATM.NOXE.EG.ZS,European Union,EUU,10.0338494874782,10.0323612350303,10.0285385121261,10.2991994422165,10.3287958935641,10.5060147813463,10.9507683652119,10.944668251265,11.5283817857679,..,..,..,..,..,..,..,..,..,..,..,..,..,..,..
Nitrous oxide emissions in energy sector (thousand metric tons of CO2 equivalent),EN.ATM.NOXE.EG.KT.CE,European Union,EUU,25435.259756,25663.512676,25807.422005,26505.351206,26826.062114,27001.430812,27653.747445,28354.452668,28275.174717,27727.398058,28324.140692,27952.213646,27968.129445,27269.345809,27004.697791,27386.835765,27501.069819,27958.269819,28104.869819,27762.769819,25424.669819,..,..,..
Public private partnerships investment in energy (current US$),IE.PPN.ENGY.CD,European Union,EUU,..,..,..,..,..,..,..,..,..,..,..,..,..,..,..,..,..,..,..,..,..,..,..,..
,,,,,,,,,,,,,,,,,,,,,,,,,,,
,,,,,,,,,,,,,,,,,,,,,,,,,,,
,,,,,,,,,,,,,,,,,,,,,,,,,,,
Data from database: World Development Indicators,,,,,,,,,,,,,,,,,,,,,,,,,,,
Last Updated: 03/28/2024,,,,,,,,,,,,,,,,,,,,,,,,,,,
Code,License Type,Indicator Name,Short definition,Long definition,Source,Topic,Periodicity,Base Period,Aggregation method,Statistical concept and methodology,Development relevance,Limitations and exceptions,General comments,License URL
EG.FEC.RNEW.ZS,CC BY-4.0,Renewable energy consumption (% of total final energy consumption),,Renewable energy consumption is the share of renewables energy in total final energy consumption.,"IEA, IRENA, UNSD, World Bank, WHO. 2023. Tracking SDG 7: The Energy Progress Report. World Bank, Washington DC. © World Bank. License: Creative Commons Attribution—NonCommercial 3.0 IGO (CC BY-NC 3.0 IGO).",Environment: Energy production & use,Annual,,Weighted average,,,,,https://datacatalog.worldbank.org/public-licenses#cc-by
EN.ATM.METH.EG.ZS,CC BY-4.0,Energy related methane emissions (% of total),,"Methane emissions from energy processes are emissions from the production, handling, transmission, and combustion of fossil fuels and biofuels.","World Bank staff estimates from original source: European Commission, Joint Research Centre (JRC)/Netherlands Environmental Assessment Agency (PBL). Emission Database for Global Atmospheric Research (EDGAR): http://edgar.jrc.ec.europa.eu/.",Environment: Emissions,Annual,,Weighted average,"IPCC category 1 = Energy. Methane emissions result largely from agricultural activities, industrial production landfills and wastewater treatment, and other sources such as tropical forest and other vegetation fires. The emissions are usually expressed in carbon dioxide equivalents using the global warming potential, which allows the effective contributions of different gases to be compared. A kilogram of methane is 21 times as effective at trapping heat in the earth's atmosphere as a kilogram of carbon dioxide within 100 years. The emissions are usually expressed in carbon dioxide equivalents using the global warming potential, which allows the effective contributions of different gases to be compared.","The addition of man-made greenhouse gases to the Atmosphere disturbs the earth's radiative balance. This is leading to an increase in the earth's surface temperature and to related effects on climate, sea level rise and world agriculture. Emissions of CO2 are from burning oil, coal and gas for energy use, burning wood and waste materials, and from industrial processes such as cement production. Emission intensity is the average emission rate of a given pollutant from a given source relative to the intensity of a specific activity. Emission intensities are also used to compare the environmental impact of different fuels or activities. The related terms - emission factor and carbon intensity - are often used interchangeably.

The carbon dioxide emissions of a country are only an indicator of one greenhouse gas. For a more complete idea of how a country influences climate change, gases such as methane and nitrous oxide should be taken into account. This is particularly important in agricultural economies.

The environmental effects of carbon dioxide are of significant interest. Carbon dioxide (CO2) makes up the largest share of the greenhouse gases contributing to global warming and climate change. Converting all other greenhouse gases (methane (CH4), nitrous oxide (N2O), hydrofluorocarbons (HFCs), perfluorocarbons (PFCs), Sulphur hexafluoride (SF6)) to carbon dioxide (or CO2) equivalents makes it possible to compare them and to determine their individual and total contributions to global warming. The Kyoto Protocol, an environmental agreement adopted in 1997 by many of the parties to the United Nations Framework Convention on Climate Change (UNFCCC), is working towards curbing CO2 emissions globally.","National reporting to the United Nations Framework Convention on Climate Change that follows the Intergovernmental Panel on Climate Change guidelines is based on national emission inventories and covers all sources of anthropogenic carbon dioxide emissions as well as carbon sinks (such as forests). To estimate emissions, the countries that are Parties to the Climate Change Convention (UNFCCC) use complex, state-of-the-art methodologies recommended by the Intergovernmental Panel on Climate Change (IPCC).",,https://datacatalog.worldbank.org/public-licenses#cc-by
EG.USE.COMM.FO.ZS,Use and distribution of these data are subject to IEA terms and conditions.,Fossil fuel energy consumption (% of total),,"Fossil fuel comprises coal, oil, petroleum, and natural gas products.","IEA Statistics © OECD/IEA 2014 (https://www.iea.org/data-and-statistics), subject to https://www.iea.org/terms/",Environment: Energy production & use,Annual,,Weighted average,Energy data are compiled by the International Energy Agency (IEA). IEA data for economies that are not members of the Organisation for Economic Co-operation and Development (OECD) are based on national energy data adjusted to conform to annual questionnaires completed by OECD member governments.

Data for combustible renewables and waste are often based on small surveys or other incomplete information and thus give only a broad impression of developments and are not strictly comparable across countries. The IEA reports include country notes that explain some of these differences. All forms of energy - primary energy and primary electricity - are converted into oil equivalents. A notional thermal efficiency of 33 percent is assumed for converting nuclear electricity into oil equivalents and 100 percent efficiency for converting hydroelectric power.,"Fossil fuels are non-renewable resources because they take millions of years to form, and reserves are being depleted much faster than new ones are being made. In developing economies growth in energy use is closely related to growth in the modern sectors - industry, motorized transport, and urban areas - but energy use also reflects climatic, geographic, and economic factors (such as the relative price of energy). Energy use has been growing rapidly in low- and middle-income economies, but high-income economies still use almost five times as much energy on a per capita basis.

Total energy use refers to the use of primary energy before transformation to other end-use fuels (such as electricity and refined petroleum products). It includes energy from combustible renewables and waste - solid biomass and animal products, gas and liquid from biomass, and industrial and municipal waste. Biomass is any plant matter used directly as fuel or converted into fuel, heat, or electricity.","The IEA makes these estimates in consultation with national statistical offices, oil companies, electric utilities, and national energy experts. The IEA occasionally revises its time series to reflect political changes, and energy statistics undergo continual changes in coverage or methodology as more detailed energy accounts become available. Breaks in series are therefore unavoidable.",Restricted use: Please contact the International Energy Agency for third-party use of these data.,https://www.iea.org/terms
EG.USE.COMM.GD.PP.KD,Use and distribution of these data are subject to IEA terms and conditions.,"Energy use (kg of oil equivalent) per $1,000 GDP (constant 2017 PPP)",,"Energy use per PPP GDP is the kilogram of oil equivalent of energy use per constant PPP GDP. Energy use refers to use of primary energy before transformation to other end-use fuels, which is equal to indigenous production plus imports and stock changes, minus exports and fuels supplied to ships and aircraft engaged in international transport. PPP GDP is gross domestic product converted to 2017 constant international dollars using purchasing power parity rates. An international dollar has the same purchasing power over GDP as a U.S. dollar has in the United States.","IEA Statistics © OECD/IEA 2014 (https://www.iea.org/data-and-statistics), subject to https://www.iea.org/terms/",Environment: Energy production & use,Annual,2017,Weighted average,,,,Restricted use: Please contact the International Energy Agency for third-party use of these data.,https://www.iea.org/terms
IE.PPI.ENGY.CD,CC BY-4.0,Investment in energy with private participation (current US$),"Investment in energy with private participation is the value of commitments to energy projects that have reached financial closure and directly or indirectly serve the public, including lease and management contracts, operation and management contracts with major capital expenditure, greenfield projects (in which a private entity or public-private joint venture builds and operates a new facility), and divestitures. Movable assets and small projects such as windmills are excluded.","Investment in energy projects with private participation  refers to commitments to  infrastructure projects in energy (electricity and natural gas: generation, transmission and distribution) that have reached financial closure and directly or indirectly serve the public. Movable assets and small projects such as windmills are excluded. The types of projects included are management and lease contracts, operations and management contracts with major capital expenditure, greenfield projects (in which a private entity or a public-private joint venture builds and operates a new facility), and divestitures. Investment commitments are the sum of investments in facilities and investments in government assets. Investments in facilities are the resources the project company commits to invest during the contract period either in new facilities or in expansion and modernization of existing facilities. Investments in government assets are the resources the project company spends on acquiring government assets such as state-owned enterprises, rights to provide services in a specific area, or the use of specific radio spectrums. Data is presented based on investment year. Data are in current U.S. dollars.","World Bank, Private Participation in Infrastructure Project Database (http://ppi.worldbank.org).",Private Sector & Trade: Private infrastructure investment,Annual,,Sum,"The data are from the World Bank's Private Participation in Infrastructure (PPI) Project database, which tracks infrastructure projects with private participation in developing countries. It provides information on more than 5,000 infrastructure projects in 139 developing economies from 1984. The database contains more than 30 fields per project record, including country, financial closure year, infrastructure services provided, type of private participation, investment, technology, capacity, project location, contract duration, private sponsors, bidding process, and development bank support.

The database is a joint product of the World Bank's Finance, Economics, and Urban Development Department and the Public-Private Infrastructure Advisory Facility. Geographic and income aggregates are calculated by the World Bank's Development Data Group.

Data are in current U.S. dollars.","Investment in infrastructure projects with private participation has made important contributions to easing fiscal constraints, improving the efficiency of infrastructure services, and extending delivery to poor people. Developing countries have been in the forefront, pioneering better approaches to infrastructure services and reaping the benefits of greater competition and customer focus. Entrepreneurship is essential to the dynamism of the modern market economy, and a greater entry density of new businesses can foster competition and economic growth.

Private sector development and investment - tapping private sector initiative and investment for socially useful purposes - are critical for poverty reduction. In parallel with public sector efforts, private investment, especially in competitive markets, has tremendous potential to contribute to growth. Private markets are the engine of productivity growth, creating productive jobs and higher incomes. And with government playing a complementary role of regulation, funding, and service provision, private initiative and investment can help provide the basic services and conditions that empower poor people - by improving health, education, and infrastructure.","The data on investment in infrastructure projects with private participation refer to all investment (public and private) in projects in which a private company assumes operating risk during the operating period or development and operating risk during the contract period. Investment refers to commitments not disbursements. Foreign state-owned companies are considered private entities for the purposes of this measure.

Investment commitments are the sum of investments in physical assets and payments to the government. Investments in physical assets are resources the project company commits to invest during the contract period in new facilities or in expansion and modernization of existing facilities. Payments to the government are the resources the project company spends on acquiring government assets such as state-owned enterprises, rights to provide services in a specific area, or use of specific radio spectrums. Data on the projects are compiled from publicly available information. The database aims to be as comprehensive as possible, but some projects - particularly those involving local and small-scale operators - may be omitted because they are not publicly reported.",,https://datacatalog.worldbank.org/public-licenses#cc-by
EN.ATM.METH.EG.KT.CE,Attribution-NonCommercial 4.0 International (CC BY-NC 4.0),Methane emissions in energy sector (thousand metric tons of CO2 equivalent),,"Methane emissions from energy processes are emissions from the production, handling, transmission, and combustion of fossil fuels and biofuels.","Climate Watch Historical GHG Emissions (1990-2020). 2023. Washington, DC: World Resources Institute. Available online at: https://www.climatewatchdata.org/ghg-emissions",Environment: Emissions,Annual,,Sum,"IPCC category 1 = Energy. Expressed in CO2 equivalent using the GWP100 metric of the Second Assessment Report of IPCC and include CH4 (GWP100=21). Methane emissions are those stemming from human activities such as agriculture and from industrial methane production. The emissions are usually expressed in carbon dioxide equivalents using the global warming potential, which allows the effective contributions of different gases to be compared. A kilogram of methane is 21 times as effective at trapping heat in the earth's atmosphere as a kilogram of carbon dioxide within 100 years. The unit of measurement is kt (kiloton) of carbon dioxide equivalent.","The addition of man-made greenhouse gases to the Atmosphere disturbs the earth's radiative balance. This is leading to an increase in the earth's surface temperature and to related effects on climate, sea level rise and world agriculture. Emissions of CO2 are from burning oil, coal and gas for energy use, burning wood and waste materials, and from industrial processes such as cement production. Emission intensity is the average emission rate of a given pollutant from a given source relative to the intensity of a specific activity. Emission intensities are also used to compare the environmental impact of different fuels or activities. The related terms - emission factor and carbon intensity - are often used interchangeably.

The carbon dioxide emissions of a country are only an indicator of one greenhouse gas. For a more complete idea of how a country influences climate change, gases such as methane and nitrous oxide should be taken into account. This is particularly important in agricultural economies.

The environmental effects of carbon dioxide are of significant interest. Carbon dioxide (CO2) makes up the largest share of the greenhouse gases contributing to global warming and climate change. Converting all other greenhouse gases (methane (CH4), nitrous oxide (N2O), hydrofluorocarbons (HFCs), perfluorocarbons (PFCs), Sulphur hexafluoride (SF6)) to carbon dioxide (or CO2) equivalents makes it possible to compare them and to determine their individual and total contributions to global warming. The Kyoto Protocol, an environmental agreement adopted in 1997 by many of the parties to the United Nations Framework Convention on Climate Change (UNFCCC), is working towards curbing CO2 emissions globally.",This series excludes Land-use Change & Forestry (LUCF). 

The world data includes international bunker fuel-related emissions and emissions from territories not part of the United Nations Framework Convention on Climate Change (UNFCCC).,,https://creativecommons.org/licenses/by-nc/4.0/
EN.ATM.NOXE.EG.ZS,CC BY-4.0,Nitrous oxide emissions in energy sector (% of total),,Nitrous oxide emissions from energy processes are emissions produced by the combustion of fossil fuels and biofuels.,"World Bank staff estimates from original source: European Commission, Joint Research Centre (JRC)/Netherlands Environmental Assessment Agency (PBL). Emission Database for Global Atmospheric Research (EDGAR): http://edgar.jrc.ec.europa.eu/.",Environment: Emissions,Annual,,Weighted average,"Nitrous oxide emissions are mainly from fossil fuel combustion, fertilizers, rainforest fires, and animal waste. Nitrous oxide is a powerful greenhouse gas, with an estimated atmospheric lifetime of 114 years, compared with 12 years for methane. The per kilogram global warming potential of nitrous oxide is nearly 310 times that of carbon dioxide within 100 years. The emissions are usually expressed in carbon dioxide equivalents using the global warming potential, which allows the effective contributions of different gases to be compared.","The addition of man-made greenhouse gases to the Atmosphere disturbs the earth's radiative balance. This is leading to an increase in the earth's surface temperature and to related effects on climate, sea level rise and world agriculture. Emissions of CO2 are from burning oil, coal and gas for energy use, burning wood and waste materials, and from industrial processes such as cement production. Emission intensity is the average emission rate of a given pollutant from a given source relative to the intensity of a specific activity. Emission intensities are also used to compare the environmental impact of different fuels or activities. The related terms - emission factor and carbon intensity - are often used interchangeably.

The carbon dioxide emissions of a country are only an indicator of one greenhouse gas. For a more complete idea of how a country influences climate change, gases such as methane and nitrous oxide should be taken into account. This is particularly important in agricultural economies.

The environmental effects of carbon dioxide are of significant interest. Carbon dioxide (CO2) makes up the largest share of the greenhouse gases contributing to global warming and climate change. Converting all other greenhouse gases (methane (CH4), nitrous oxide (N2O), hydrofluorocarbons (HFCs), perfluorocarbons (PFCs), Sulphur hexafluoride (SF6)) to carbon dioxide (or CO2) equivalents makes it possible to compare them and to determine their individual and total contributions to global warming. The Kyoto Protocol, an environmental agreement adopted in 1997 by many of the parties to the United Nations Framework Convention on Climate Change (UNFCCC), is working towards curbing CO2 emissions globally.","National reporting to the United Nations Framework Convention on Climate Change that follows the Intergovernmental Panel on Climate Change guidelines is based on national emission inventories and covers all sources of anthropogenic carbon dioxide emissions as well as carbon sinks (such as forests). To estimate emissions, the countries that are Parties to the Climate Change Convention (UNFCCC) use complex, state-of-the-art methodologies recommended by the Intergovernmental Panel on Climate Change (IPCC).",,https://datacatalog.worldbank.org/public-licenses#cc-by
